{
  "id": "triage-004",
  "domain": "triage",
  "intent": "ask_cough",
  "speaker": "provider",
  "risk": "low",
  "expects": "yes_no",
  "choices": [],
  "pictogram": "😮‍💨",
  "text": {
    "en": "Are you coughing?",
    "th": "คุณมีอาการไอหรือไม่?",
    "my": "ခင်ဗျားချောင်းဆိုးလား။",
    "mnw": null
  },
  "status": {
    "en": "machine",
    "th": "machine",
    "my": "human",
    "mnw": "draft"
  },
  "review": {},
  "audio": {
    "my": {
      "file": "audio/my/triage-004.ogg",
      "kind": "synthetic",
      "voice": "facebook/mms-tts-mya",
      "date": "2026-10-13"
    },
    "mnw": null
  },
  "source": {
    "id": "mymedicon-text-v0.8",
    "line": 440,
    "license": "CC-BY-NC-SA-4.0",
    "source_text": {
      "en": "Are you coughing?",
      "th": "คุณ มี อา กา รไ อหรื อไม ่?",
      "my": "ခင်ဗျား ချောင်းဆိုး လား ။"
    },
    "note": "English is a Quillbot paraphrase of the clinical handbook; Burmese was human-translated by university students; Thai is Google Translate output. Whitespace removed from Thai and Burmese for display."
  },
  "notes": ""
}
