{
  "id": "antenatal-005",
  "domain": "antenatal",
  "intent": "ask_breastfeeding",
  "speaker": "provider",
  "risk": "low",
  "expects": "yes_no",
  "choices": [],
  "pictogram": "hi:people/lactation",
  "text": {
    "en": "Does your child receive breast milk?",
    "th": "คุณให้นมลูกหรือไม่?",
    "my": "ခင်ဗျားကလေးကိုနို့တိုက်လား။",
    "mnw": null
  },
  "status": {
    "en": "machine",
    "th": "machine",
    "my": "human",
    "mnw": "draft"
  },
  "review": {},
  "audio": {
    "my": {
      "file": "audio/my/antenatal-005.ogg",
      "kind": "synthetic",
      "voice": "facebook/mms-tts-mya",
      "date": "2026-10-13"
    },
    "mnw": null
  },
  "source": {
    "id": "mymedicon-text-v0.8",
    "line": 4474,
    "license": "CC-BY-NC-SA-4.0",
    "source_text": {
      "en": "Does your child receive breast milk?",
      "th": "คุณ ให้ นม ลู กหรื อไม ่?",
      "my": "ခင်ဗျား ကလေး ကို နို့တိုက် လား ။"
    },
    "note": "English is a Quillbot paraphrase of the clinical handbook; Burmese was human-translated by university students; Thai is Google Translate output. Whitespace removed from Thai and Burmese for display."
  },
  "notes": ""
}
