{
  "id": "tb-malaria-005",
  "domain": "tb-malaria",
  "intent": "inform_blood_tests",
  "speaker": "provider",
  "risk": "medium",
  "expects": "none",
  "choices": [],
  "pictogram": "hi:devices/test-tubes",
  "text": {
    "en": "In order to determine what might have caused this, we now need to run certain blood tests.",
    "th": "ตอนนี้เราจำเป็นต้องทำการตรวจเลือดเพื่อหาสาเหตุที่เป็นไปได้",
    "my": "အခုကျွန်တော်တို့ဒီဟာရဲ့အကြောင်းအရင်းကဘာဖြစ်နိုင်လဲဆိုတာရှာဖွေဖို့သွေးစစ်ချက်အချို့ကိုလုပ်ဆောင်ဖို့လိုအပ်တယ်။",
    "mnw": null
  },
  "status": {
    "en": "machine",
    "th": "machine",
    "my": "human",
    "mnw": "draft"
  },
  "review": {},
  "audio": {
    "my": {
      "file": "audio/my/tb-malaria-005.ogg",
      "kind": "synthetic",
      "voice": "facebook/mms-tts-mya",
      "date": "2026-10-13"
    },
    "mnw": null
  },
  "source": {
    "id": "mymedicon-text-v0.8",
    "line": 1325,
    "license": "CC-BY-NC-SA-4.0",
    "source_text": {
      "en": "In order to determine what might have caused this, we now need to run certain blood tests.",
      "th": "ตอนนี้ เรา จำเป็น ต้อง ทำ การตรวจ เลือด เพื่อ หา สาเหตุ ที่เป็นไปได้",
      "my": "အခု ကျွန်တော် တို့ ဒီ ဟာ ရဲ့ အကြောင်းအရင်း က ဘာ ဖြစ် နိုင် လဲ ဆိုတာ ရှာဖွေ ဖို့ သွေးစစ် ချက် အချို့ ကို လုပ်ဆောင် ဖို့ လိုအပ် တယ် ။"
    },
    "note": "English is a Quillbot paraphrase of the clinical handbook; Burmese was human-translated by university students; Thai is Google Translate output. Whitespace removed from Thai and Burmese for display."
  },
  "notes": ""
}
