{
  "id": "pharmacy-001",
  "domain": "pharmacy",
  "intent": "avoid_yaa_chud_packs",
  "speaker": "provider",
  "risk": "medium",
  "expects": "yes_no",
  "choices": [],
  "pictogram": "hi:medications/blister-pills_oval_x4",
  "text": {
    "en": "Do not buy loose pill packs from the shop for pain. Have you taken any?",
    "th": "อย่าซื้อยาชุดจากร้านมากินแก้ปวด คุณเคยกินยาชุดไหม",
    "my": null,
    "mnw": null
  },
  "status": {
    "en": "draft",
    "th": "draft",
    "my": "draft",
    "mnw": "draft"
  },
  "review": {},
  "audio": {
    "my": null,
    "mnw": null
  },
  "source": {
    "id": "saphan-authored",
    "license": "CC-BY-NC-SA-4.0",
    "note": "Written 2026-10-13 from the disease-burden report. English and Thai are unreviewed drafts by the scaffold author."
  },
  "notes": "Yaa chud packs in Kanchanaburi contain antibiotics plus steroids (PMC6647088). This record is skipped at build until Burmese or Mon reaches status 'human'."
}
