{
  "id": "triage-001",
  "domain": "triage",
  "intent": "greet",
  "speaker": "provider",
  "risk": "low",
  "expects": "none",
  "choices": [],
  "pictogram": "👋",
  "text": {
    "en": "Hi there",
    "th": "สวัสดี",
    "my": "မင်္ဂလာပါ။",
    "mnw": null
  },
  "status": {
    "en": "machine",
    "th": "machine",
    "my": "human",
    "mnw": "draft"
  },
  "review": {},
  "audio": {
    "my": {
      "file": "audio/my/triage-001.ogg",
      "kind": "synthetic",
      "voice": "facebook/mms-tts-mya",
      "date": "2026-10-13"
    },
    "mnw": null
  },
  "source": {
    "id": "mymedicon-text-v0.8",
    "line": 1,
    "license": "CC-BY-NC-SA-4.0",
    "source_text": {
      "en": "Hi there",
      "th": "สวัสดี",
      "my": "မင်္ဂလာပါ ။"
    },
    "note": "English is a Quillbot paraphrase of the clinical handbook; Burmese was human-translated by university students; Thai is Google Translate output. Whitespace removed from Thai and Burmese for display."
  },
  "notes": ""
}
